{
  "experiment_id": "exp_20260309_180000_0001",
  "proposal_id": "p_base_2k_0001",
  "campaign_id": "base_2k",
  "lane": "scout",
  "status": "completed",
  "disposition": "promoted",
  "crash_class": null,
  "primary_metric_name": "val_bpb",
  "primary_metric_value": 0.971234,
  "metric_delta": -0.000512,
  "budget_seconds": 90,
  "train_seconds": 80.2,
  "eval_seconds": 7.3,
  "compile_seconds": 1.8,
  "tokens_processed": 393216,
  "tokens_per_second": 4902.9,
  "steady_state_mfu": 0.43,
  "peak_vram_gb": 18.7,
  "param_count": 123456789,
  "backend": "flash_attention",
  "device_profile": "rtx_pro_6000_96gb",
  "seed": 42,
  "config_fingerprint": "abc123deadbeef",
  "git_commit": "deadbeef",
  "warnings": [],
  "checkpoint_path": "artifacts/runs/exp_20260309_180000_0001/checkpoints/pre_eval.safetensors",
  "summary_version": "1.0.0",
  "started_at": "2026-03-09T18:00:01Z",
  "ended_at": "2026-03-09T18:01:31Z"
}
